<?xml version="1.0" encoding="UTF-8"?>
<evaml name="game-of-emotions-ING"
	xsi:noNamespaceSchemaLocation="/home/marcelo/Dropbox/Estudo XML/EvaML-Schema/evaml_schema.xsd"
	xmlns:xsi="http://www.w3.org/2001/XMLSchema-instance">
	<settings>
		<voice tone="en-US_AllisonV3Voice" />
	</settings>
	<script>
		<light state="on" color="white" />
		<evaEmotion emotion="neutral" />
		<talk>Hi, I am the robot Eva!</talk>
		<audio source="mario-game-intro" block="true" />
		<talk>Shall we play the emotions game?</talk>
		<evaEmotion emotion="happy" />
		<audio source="mario-start-01" block="true" />
		<evaEmotion emotion="neutral" />
		<talk>What is your name?</talk>
		<audio source="mario-sound1" block="true" />
			<led animation="listen" />
			<wait duration="4000" />
			<led animation="stop" />
			<wait duration="1000" />
		<evaEmotion emotion="happy" />
		<talk>Very nice!</talk>
		<talk>Let's go Marcelo</talk>
		<evaEmotion emotion="neutral" />
		<talk>I will show you my emotions</talk>
		<audio source="mario-sound1" block="true" />
		<talk>I look like this when I am happy</talk>
		<evaEmotion emotion="happy" />
		<light state="on" color="green" />
		<led animation="happy" />
		<wait duration="2000" />
		<evaEmotion emotion="neutral" />
		<talk>I look like this when I am sad</talk>
		<audio source="mario-sound1" block="true" />
		<evaEmotion emotion="sad" />
		<light state="on" color="blue" />
		<led animation="sad" />
		<wait duration="2000" />
		<evaEmotion emotion="neutral" />
		<talk>I look like this when I am angry</talk>
		<audio source="mario-sound1" block="true" />
		<evaEmotion emotion="angry" />
		<light state="on" color="red" />
		<led animation="angry" />
		<wait duration="2000" />
		<evaEmotion emotion="neutral" />
		<light state="on" color="white" />
		<talk>Let's start the game</talk>
		<!-- ############ Primeira emoção com duas tentativas ############ -->
		<counter var="try" op="=" value="1" />
		<evaEmotion id="EMOCAO1" emotion="neutral" />
		<light state="on" color="white" />
		<talk>How am I feeling?</talk>
		<talk>Happy, sad, or, angry?</talk>
		<evaEmotion emotion="sad" />
		<light state="on" color="blue" />
		<audio source="mario-sound1" block="true" />
			<led animation="listen" />
			<wait duration="4000" />
			<led animation="stop" />
			<wait duration="1000" />
				<audio source="mario-start-02" block="true" />
				<talk>Very good! You are right!</talk>
			
		<evaEmotion emotion="happy" />
		<wait duration="1000" />
		<!-- ############ Segunda emoção com duas tentativas ############ -->
		<counter var="try" op="=" value="1" />
		<evaEmotion id="EMOCAO2" emotion="neutral" />
		<light state="on" color="white" />
		<talk>How am I feeling?</talk>
		<talk>Happy, sad, or, angry?</talk>
		<evaEmotion emotion="angry" />
		<light state="on" color="red" />
		<audio source="mario-sound1" block="true" />
			<led animation="listen" />
			<wait duration="4000" />
			<led animation="stop" />
			<wait duration="1000" />
			<audio source="mario-start-02" block="true" />
			<talk>Nice! You are right!</talk>
			
		<evaEmotion emotion="happy" />
		<wait duration="1000" />
		<!-- ############ Terceira emoção com duas tentativas ############ -->
		<counter var="try" op="=" value="1" />
		<evaEmotion id="EMOCAO3" emotion="neutral" />
		<light state="on" color="white" />
		<talk>How am I feeling?</talk>
		<talk>Happy, sad, or, angry?</talk>
		<evaEmotion emotion="happy" />
		<light state="on" color="green" />
		<audio source="mario-sound1" block="true" />
			<led animation="listen" />
			<wait duration="4000" />
			<led animation="stop" />
			<wait duration="1000" />
		
				<audio source="mario-sound1" block="true" />
				<talk>I am feeling happy</talk>
						<wait duration="2000" />
						<talk>Let's try one more time</talk>
						<wait duration="2000" />
						<evaEmotion emotion="neutral" />
						<light state="on" color="white" />
						<talk>How am I feeling?</talk>
						<talk>Happy, sad, or, angry?</talk>
						<evaEmotion emotion="happy" />
						<light state="on" color="green" />
						<audio source="mario-sound1" block="true" />
							<led animation="listen" />
							<wait duration="4000" />
							<led animation="stop" />
							<wait duration="1000" />
							<audio source="mario-start-02" block="true" />
							<talk>Perfect! You are correct </talk>
		<evaEmotion emotion="happy" />
		<talk>It was really nice to play with you Marcelo</talk>
		<audio source="mario-end-02" block="true" />
		<light state="off" />
	</script>
</evaml>
