<evaml xmlns:xsi="http://www.w3.org/2001/XMLSchema-instance" name="teste4" xsi:noNamespaceSchemaLocation="EvaML-Schema/evaml_schema.xsd" id="73bf3127fb3c9791e88a4d308171fd85">
  <settings>
      <voice tone="en-US_AllisonV3Voice" key="1000" />
      <lightEffects mode="OFF" />
      <audioEffects mode="ON" />
    </settings>
    <script>
      <light state="ON" color="RED" key="1001" />
      <wait duration="1000" key="1002" />
      <light state="ON" color="BLACK" key="1003" />
      <wait duration="1000" key="1004" />
      <light state="ON" color="BLUE" key="1005" />
      <wait duration="1000" key="1006" />
      <light state="ON" color="GREEN" key="1007" />
      <wait duration="1000" key="1008" />
      <light state="ON" color="PINK" key="1009" />
      <wait duration="1000" key="1010" />
      <light state="ON" color="WHITE" key="1011" />
      <wait duration="1000" key="1012" />
      <light state="ON" color="YELLOW" key="1013" />
      <wait duration="1000" key="1014" />
    </script>
</evaml>